"Topic", "Question", "Option A", "Option B", "Option C", "Option D", "Correct Answer"
"BPlusTree", "What happens to the promoted key during an internal node split in a BPlusTree?", "A. It stays in the original node and is copied to the parent.", "B. It is moved to the new sibling node.", "C. It is promoted to the parent, but also copied into the new sibling node.", "D. It is discarded.", "A"
"BPlusTree", "What happens to the promoted key during a leaf node split in a BPlusTree?", "A. It stays in the original node.", "B. It is moved to the new sibling node.", "C. It is copied to the parent, and the median value is also part of the new sibling node.", "D. It is discarded.", "C"
"BPlusTree", "Are all leaf nodes in a BPlusTree required to be at the same level?", "A. No, only in specific types.", "B. Yes, always.", "C. Only if the tree is perfectly balanced.", "D. It depends on the insertion order.", "B"
"BPlusTree", "What is the time complexity for search, insertion, and deletion operations in a BPlusTree with `N` keys and minimum degree `t`?", "A. O(log N)", "B. O(log_t N)", "C. O(t * log_t N)", "D. O(N)", "C"
"BPlusTree", "In a BPlusTree, keys within a node (both internal and leaf) are kept in what order?", "A. Unsorted.", "B. Random order.", "C. Sorted order.", "D. Reverse sorted order.", "C"
"BPlusTree", "What is the role of the pointers (children) in an internal node of a BPlusTree?", "A. They point to sibling nodes.", "B. They point to data records.", "C. They point to subtrees (child nodes).", "D. They store actual data values.", "C"
"BPlusTree", "What is the role of the pointers in a leaf node of a BPlusTree?", "A. They point to child nodes.", "B. They point to other leaf nodes in a sequential manner (sibling pointers).", "C. They point to parent nodes.", "D. They store actual data values.", "B"
"BPlusTree", "When a key is deleted from a BPlusTree and a node underflows, what operations might be performed?", "A. Rotations and recoloring.", "B. Merging with a sibling or borrowing from a sibling.", "C. Rebuilding the entire tree.", "D. Moving the key to a leaf node.", "B"
"BPlusTree", "What is the primary advantage of BPlusTrees over hash tables for database indexing?", "A. Faster average-case lookup.", "B. Efficient range queries and sorted traversal.", "C. Less memory usage.", "D. Simpler implementation.", "B"
"BPlusTree", "Can a BPlusTree store duplicate keys?", "A. No, BPlusTrees fundamentally require unique keys.", "B. Yes, they are typically handled by storing duplicate keys or pointers to multiple data records at leaf nodes.", "C. Only if it's a very small tree.", "D. Only if the duplicates are in internal nodes.", "B"
"BPlusTree", "What happens to the height of a BPlusTree if the root node splits?", "A. It decreases by one.", "B. It remains the same.", "C. It increases by one.", "D. It becomes zero.", "C"
"BPlusTree", "What is the main reason for BPlusTrees' efficiency in disk-based systems?", "A. They keep all data in memory.", "B. Their shallow height due to high fan-out minimizes disk I/O operations.", "C. They use a hashing mechanism.", "D. They perform constant-time operations.", "B"
"BPlusTree", "In a BPlusTree, if you search for a key, where will you eventually find the data record associated with it?", "A. In the root node.", "B. In any internal node.", "C. Always in a leaf node.", "D. It depends on the key value.", "C"
"BPlusTree", "What is the typical 'order' of a BPlusTree in a practical database system?", "A. Very small (e.g., 2-4).", "B. Very large (e.g., hundreds or thousands).", "C. Depends on the number of records.", "D. Fixed at 10.", "B"
"BPlusTree", "When a leaf node underflows in a BPlusTree, and it cannot borrow from a sibling, what operation is performed?", "A. Rotation.", "B. Splitting.", "C. Merging with a sibling.", "D. Deletion of the underflowed node.", "C"
"BPlusTree", "When an internal node underflows in a BPlusTree, and it cannot borrow from a sibling, what operation is performed?", "A. Rotation.", "B. Splitting.", "C. Merging with a sibling (and potentially adjusting parent's key).", "D. Deletion of the underflowed node.", "C"
"BPlusTree", "What is the common term for a BPlusTree index where keys are stored in the same order as the physical data records on disk?", "A. Secondary index.", "B. Clustered index.", "C. Non-clustered index.", "D. Hash index.", "B"
"BPlusTree", "What is the common term for a BPlusTree index where keys store pointers to the physical data records, which might be in a different order?", "A. Secondary index.", "B. Clustered index.", "C. Non-clustered index.", "D. Hash index.", "C"
"BPlusTree", "If a BPlusTree has `N` records, and block size allows `B` keys per node, what is its height approximately?", "A. O(N)", "B. O(log_B N)", "C. O(B * log N)", "D. O(N^2)", "B"
"BPlusTree", "How does a BPlusTree ensure that all search operations involve traversing from the root to a leaf?", "A. Only leaf nodes contain data pointers, forcing traversal to the lowest level.", "B. Internal nodes contain pointers to siblings.", "C. The root is always a leaf node.", "D. Search is only done on leaf nodes.", "A"
"BPlusTree", "What happens to the key values in internal nodes during an insertion into a BPlusTree?", "A. They are copied to leaf nodes.", "B. They serve as separators, guiding search to the correct child branch.", "C. They are deleted after guiding the search.", "D. They store actual data.", "B"
"BPlusTree", "What is the minimum degree `t` of a BPlusTree?", "A. The maximum number of children a node can have.", "B. The minimum number of children a non-root internal node must have.", "C. The height of the tree.", "D. The number of keys in the root.", "B"
"BPlusTree", "In a BPlusTree of minimum degree `t`, an internal node with `k` keys will have how many children?", "A. k", "B. k+1", "C. k-1", "D. 2k", "B"
"BPlusTree", "What is a 'sequence set' in a BPlusTree?", "A. The set of all internal nodes.", "B. The linked list of leaf nodes, containing all data records.", "C. A sorted list of all keys in the tree.", "D. The set of all root nodes.", "B"
"BPlusTree", "What is an 'index set' in a BPlusTree?", "A. The set of all leaf nodes.", "B. The collection of internal nodes that form the search path structure.", "C. A sorted list of all data records.", "D. The set of all keys in the tree.", "B"
"BPlusTree", "Is the root of a BPlusTree ever a leaf node?", "A. No, never.", "B. Yes, if the tree contains only a few keys (less than the max keys of a leaf node).", "C. Only if it's a BTree.", "D. Only if `m` is 2.", "B"
"BPlusTree", "When searching for a key not present in a BPlusTree, where does the search terminate?", "A. At the root node.", "B. At an internal node.", "C. At a leaf node, indicating the key is not found.", "D. It crashes.", "C"
"BPlusTree", "What is the primary disadvantage of BPlusTrees compared to hash tables?", "A. Slower range queries.", "B. Slower average-case single key lookups.", "C. Greater memory usage.", "D. More complex implementation.", "B"
"BPlusTree", "What is the advantage of BPlusTrees over simple sorted arrays?", "A. Faster sequential access.", "B. Efficient insertion and deletion of elements without massive shifting.", "C. Less memory usage.", "D. Simpler implementation.", "B"
"BPlusTree", "Which database operations benefit most from BPlusTrees?", "A. Full table scans.", "B. Insertions, deletions, and especially range-based queries (e.g., WHERE price BETWEEN X AND Y).", "C. Aggregation (SUM, AVG).", "D. Join operations between large tables.", "B"
"BPlusTree", "When is the height of a BPlusTree guaranteed to increase?", "A. Every time a new record is inserted.", "B. Only when the root node splits.", "C. When any internal node splits.", "D. When any leaf node splits.", "B"
"BPlusTree", "What kind of data are BPlusTrees typically used to index?", "A. Only integer data.", "B. Only string data.", "C. Data that needs to be accessed efficiently by key, and often in ranges.", "D. Small, volatile datasets.", "C"
"BPlusTree", "What is the implication of all data records being in the leaf nodes of a BPlusTree?", "A. Internal nodes can be smaller, fitting more keys per block.", "B. Search operations require fewer disk I/Os.", "C. Deletion is always simpler.", "D. Range queries are slower.", "A"
"BPlusTree", "How do BPlusTrees handle duplicate keys (if allowed)?", "A. By placing all duplicate data records directly in the internal nodes.", "B. By storing multiple data pointers for the same key in a leaf node, or by chaining duplicate records.", "C. They strictly forbid duplicates.", "D. By always assigning duplicates to the rightmost child.", "B"
"BPlusTree", "What is the 'fan-out' of a BPlusTree node?", "A. The number of keys in the node.", "B. The number of child pointers (or children).", "C. The height of the node.", "D. The depth of the node.", "B"
"BPlusTree", "In a BPlusTree, what does the term 'order' often refer to?", "A. The minimum number of keys in a node.", "B. The maximum number of keys (or pointers) that can be stored in a node.", "C. The height of the tree.", "D. The number of leaf nodes.", "B"
"BPlusTree", "What is a major concern when designing BPlusTrees for a database?", "A. The choice of colors for nodes.", "B. The size of the disk blocks, which dictates the node size and fan-out.", "C. The number of CPUs available.", "D. The type of sorting algorithm used.", "B"
"BPlusTree", "What ensures that a BPlusTree remains balanced?", "A. Random insertions and deletions.", "B. The split and merge operations that maintain minimum and maximum key/child constraints for nodes.", "C. Periodic full tree rebuilds.", "D. Only balanced data input.", "B"
"BPlusTree", "Which operation is generally considered to be the most complex in a BPlusTree?", "A. Search.", "B. Insertion (due to potential splits and propagation).", "C. Deletion (due to potential merges/borrows and propagation).", "D. Traversing the leaf nodes.", "C"
"SegmentTree", "What is a SegmentTree primarily used for?", "A. Storing strings efficiently.", "B. Performing range queries (e.g., sum, min, max, XOR) and point/range updates on an array efficiently.", "C. Representing hierarchical file systems.", "D. Solving shortest path problems.", "B"
"SegmentTree", "What is the time complexity of building a SegmentTree from an array of `N` elements?", "A. O(1)", "B. O(log N)", "C. O(N)", "D. O(N log N)", "C"
"SegmentTree", "What is the time complexity of performing a range query (e.g., sum) on a SegmentTree with `N` elements?", "A. O(1)", "B. O(log N)", "C. O(N)", "D. O(N log N)", "B"
"SegmentTree", "What is the time complexity of performing a point update on a SegmentTree with `N` elements?", "A. O(1)", "B. O(log N)", "C. O(N)", "D. O(N log N)", "B"
"SegmentTree", "What is the space complexity of a SegmentTree built on an array of `N` elements?", "A. O(N)", "B. O(log N)", "C. O(N log N)", "D. O(N^2)", "A"
"SegmentTree", "How many nodes does a SegmentTree typically have for an array of size `N`?", "A. Exactly N nodes.", "B. Approximately 2N to 4N nodes.", "C. Approximately N log N nodes.", "D. Exactly log N nodes.", "B"
"SegmentTree", "What kind of operation does each node in a SegmentTree represent?", "A. A single element from the original array.", "B. A range or segment of the original array.", "C. The entire original array.", "D. A pointer to another node.", "B"
"SegmentTree", "Which of the following problems can be efficiently solved using a SegmentTree?", "A. Finding the shortest path in a graph.", "B. Searching for a specific element in an unsorted list.", "C. Finding the sum of elements in a given range [L, R] and updating an element.", "D. Sorting an array.", "C"
"SegmentTree", "SegmentTrees are typically implemented using which underlying data structure?", "A. Linked List", "B. Adjacency List", "C. Array (implicit tree representation)", "D. Hash Map", "C"
"SegmentTree", "If a SegmentTree node covers the range [L, R], what ranges do its children typically cover?", "A. [L, L+1] and [R-1, R]", "B. [L, M] and [M+1, R], where M is (L+R)/2", "C. [L, R/2] and [R/2+1, R]", "D. [0, L] and [R, N-1]", "B"
"SegmentTree", "In a SegmentTree, the leaf nodes correspond to what?", "A. The entire array range.", "B. Individual elements of the original array.", "C. Half of the original array.", "D. Ranges that cannot be further divided.", "B"
"SegmentTree", "Why is `log N` complexity achieved for queries and updates in a SegmentTree?", "A. Because the tree is always perfectly balanced.", "B. Because at each step, the search/update range is halved.", "C. Due to constant time operations at each node.", "D. Because it uses hashing.", "B"
"SegmentTree", "Can a SegmentTree handle point updates (changing a single element's value)?", "A. No, only range updates.", "B. Yes, by traversing down to the leaf and updating ancestors.", "C. Only if the array is sorted.", "D. Only for the root element.", "B"
"SegmentTree", "Can a SegmentTree handle range updates (changing all elements in a range)?", "A. No, only point updates.", "B. Yes, typically with a technique called 'lazy propagation'.", "C. Only if the range is small.", "D. Only by rebuilding the entire tree.", "B"
"SegmentTree", "What is 'lazy propagation' in the context of SegmentTrees used for?", "A. To speed up point queries.", "B. To optimize range updates by deferring updates to child nodes.", "C. To balance the tree.", "D. To reduce memory usage.", "B"
"SegmentTree", "When performing a range query in a SegmentTree, if a node's range is completely contained within the query range, what happens?", "A. The function recursively calls its children.", "B. The value stored in that node is directly returned (and combined).", "C. The node is skipped.", "D. The tree is rebuilt.", "B"
"SegmentTree", "When performing a range query in a SegmentTree, if a node's range is outside the query range, what happens?", "A. Its value is returned.", "B. It is skipped (often by returning an identity element).", "C. It causes an error.", "D. It is fully traversed.", "B"
"SegmentTree", "What is the identity element for a sum query in a SegmentTree?", "A. 0", "B. 1", "C. -1", "D. Infinity", "A"
"SegmentTree", "What is the identity element for a minimum query in a SegmentTree?", "A. 0", "B. 1", "C. Negative infinity", "D. Positive infinity", "D"
"SegmentTree", "What is the identity element for a maximum query in a SegmentTree?", "A. 0", "B. 1", "C. Negative infinity", "D. Positive infinity", "C"
"SegmentTree", "When building a SegmentTree, why is it often padded to the next power of two?", "A. To ensure the tree is always a complete binary tree for simpler array mapping.", "B. To reduce memory usage.", "C. To make it a balanced binary search tree.", "D. It's not necessary.", "A"
"SegmentTree", "What type of tree structure does a SegmentTree naturally form?", "A. A skewed tree.", "B. A complete binary tree (conceptually, when padded).", "C. A perfect binary tree.", "D. A balanced search tree (like AVL).", "B"
"SegmentTree", "Can a SegmentTree handle operations other than sum, min, max (e.g., XOR, GCD)?", "A. No, it's limited to these basic operations.", "B. Yes, as long as the operation is associative and has an identity element.", "C. Only if the array contains specific data types.", "D. Only with significant modifications.", "B"
"SegmentTree", "Is a SegmentTree a Binary Search Tree?", "A. Yes, always.", "B. No, it's a binary tree that represents array segments, not ordered elements for search by value.", "C. Only if it's perfectly balanced.", "D. Only for specific types of data.", "B"
"SegmentTree", "What happens during a push-down operation in lazy propagation?", "A. The pending update is applied to the current node.", "B. The pending update is pushed from the current node to its children.", "C. The array is updated.", "D. The query result is returned.", "B"
"SegmentTree", "When is a push-down operation typically performed in lazy propagation?", "A. After every query.", "B. Before querying or updating a node's children.", "C. Only when the tree is built.", "D. Only when a leaf node is reached.", "B"
"SegmentTree", "What is the depth of a SegmentTree (root at depth 0) for an array of size `N`?", "A. O(N)", "B. O(log N)", "C. O(N log N)", "D. O(sqrt(N))", "B"
"SegmentTree", "If a SegmentTree is implemented using an array, what is the parent of node at index `i` (0-indexed, root at 0)?", "A. `(i-1)/2`", "B. `i/2`", "C. `2*i+1`", "D. `2*i+2`", "A"
"SegmentTree", "If a SegmentTree is implemented using an array, what are the children of node at index `i` (0-indexed, root at 0)?", "A. `(i-1)/2, i/2`", "B. `i/2, i/2 + 1`", "C. `2*i+1, 2*i+2`", "D. `i-1, i+1`", "C"
"SegmentTree", "For an array `[1, 2, 3, 4]`, what range would the root of a SegmentTree typically cover?", "A. `[1, 1]`", "B. `[1, 4]`", "C. `[2, 3]`", "D. `[0, 3]` (if 0-indexed)", "D"
"SegmentTree", "If a range query is for `[L, R]`, and a node covers `[nodeL, nodeR]`. If `nodeR < L` or `nodeL > R`, what does this imply?", "A. The node's range is completely outside the query range.", "B. The node's range is completely inside the query range.", "C. The node's range partially overlaps the query range.", "D. An error has occurred.", "A"
"SegmentTree", "If a SegmentTree is used for point updates and range sums, and an element at index `i` is updated, which nodes need to be updated?", "A. Only the leaf node corresponding to `i`.", "B. Only the root node.", "C. The leaf node for `i` and all its ancestor nodes up to the root.", "D. All nodes in the tree.", "C"
"SegmentTree", "What is a 'persistent SegmentTree' used for?", "A. Storing data permanently on disk.", "B. Allowing queries on past versions of the array without rebuilding the tree.", "C. Making the tree more robust to failures.", "D. Optimizing memory usage.", "B"
"SegmentTree", "How does a persistent SegmentTree achieve its functionality?", "A. By copying the entire tree for each update.", "B. By creating new nodes only for the modified path and sharing untouched parts.", "C. By storing diffs between versions.", "D. By hashing each version.", "B"
"SegmentTree", "What is a 'Fenwick Tree' (Binary Indexed Tree) related to a SegmentTree?", "A. It's a type of SegmentTree.", "B. It's an alternative data structure for similar problems, often simpler for point updates and prefix sums.", "C. It's a precursor to SegmentTrees.", "D. It's a completely unrelated data structure.", "B"
"SegmentTree", "When would you prefer a SegmentTree over a Fenwick Tree?", "A. For simple point updates and prefix sums.", "B. When dealing with range updates and/or operations that are not easily invertible (like min/max).", "C. When memory is extremely limited.", "D. When the array is very small.", "B"
"SegmentTree", "Which of the following operations would be challenging to implement with a simple SegmentTree without lazy propagation?", "A. Point sum query.", "B. Point update.", "C. Range sum query.", "D. Range update (e.g., add X to all elements in [L,R]).", "D"
"SegmentTree", "What is the primary advantage of a SegmentTree over a simple array for range queries and updates?", "A. It always uses less memory.", "B. It offers logarithmic time complexity for these operations, whereas a simple array would be linear.", "C. It is simpler to implement.", "D. It can store more data.", "B"
"SegmentTree", "If a SegmentTree stores maximum values, and a node has value `V`, what does `V` represent?", "A. The maximum value in the original array.", "B. The maximum value in the range covered by that node.", "C. The maximum value of its children.", "D. The maximum value of the entire tree.", "B"
"SegmentTree", "Can a SegmentTree be used on a dynamic array (where elements are added/removed from ends)?", "A. Yes, with specific modifications like implicit segment trees or dynamic segment trees.", "B. No, it requires a fixed-size array.", "C. Only if the array size doubles/halves.", "D. Only for very small arrays.", "A"
"SegmentTree", "What is the base case for the recursive build function of a SegmentTree?", "A. When the range becomes empty.", "B. When the range contains a single element (a leaf node).", "C. When the range is the entire array.", "D. When the tree reaches a certain depth.", "B"
"SegmentTree", "In a standard SegmentTree, does each node explicitly store its left and right child pointers?", "A. Yes, always.", "B. No, they are implicitly determined by array indices.", "C. Only the root node.", "D. Only leaf nodes.", "B"
"SegmentTree", "What is the typical value initialized to a SegmentTree node if the operation is a sum and the range is invalid/empty?", "A. -1", "B. 0", "C. Infinity", "D. The last element.", "B"
"SegmentTree", "What is the typical value initialized to a SegmentTree node if the operation is a minimum and the range is invalid/empty?", "A. -1", "B. 0", "C. Positive Infinity", "D. The first element.", "C"
"SegmentTree", "Can a SegmentTree be used to find the number of elements less than X in a given range?", "A. Yes, with additional data in nodes or by building a specialized SegmentTree (e.g., on counts).", "B. No, it only supports sum, min, max.", "C. Only if the array is sorted.", "D. Only for point queries.", "A"
"SegmentTree", "What is the disadvantage of using a SegmentTree for very sparse arrays?", "A. It performs too slowly.", "B. It consumes a lot of memory for empty/unused ranges.", "C. It cannot handle sparse data.", "D. Updates become too complex.", "B"
"SegmentTree", "How does a SegmentTree compare to a square root decomposition approach for range queries/updates?", "A. SegmentTree is generally faster (O(log N) vs O(sqrt N)).", "B. Square root decomposition is always faster.", "C. They have similar complexity.", "D. Square root decomposition uses less memory.", "A"
"SegmentTree", "What is the conceptual 'root' of a SegmentTree?", "A. The first element of the array.", "B. A node representing the entire range of the original array.", "C. The smallest element in the array.", "D. A placeholder node.", "B"
"SegmentTree", "If a range query is [ql, qr] and a node covers [nl, nr]. What happens if there's a partial overlap (e.g., nl < ql < nr)?", "A. The node's value is returned directly.", "B. The node is skipped.", "C. The query recurses into both children, and their results are combined.", "D. The query stops.", "C"
"SegmentTree", "What is the fundamental principle that allows SegmentTrees to work efficiently for range operations?", "A. Data compression.", "B. Divide and Conquer.", "C. Hashing.", "D. Graph traversal.", "B"
"FenwickTree", "What is another common name for a Fenwick Tree?", "A. Segment Tree", "B. AVL Tree", "C. Binary Indexed Tree (BIT)", "D. Red-Black Tree", "C"
"FenwickTree", "What are the primary operations that a Fenwick Tree efficiently supports?", "A. Range queries (sum, min, max) and range updates.", "B. Point updates and prefix sum queries.", "C. Insertion and deletion of arbitrary elements.", "D. Finding shortest paths in a graph.", "B"
"FenwickTree", "What is the time complexity of building a Fenwick Tree from an array of `N` elements (initializing to zero then N point updates)?", "A. O(1)", "B. O(log N)", "C. O(N)", "D. O(N log N)", "D"
"FenwickTree", "What is the time complexity of performing a prefix sum query (sum from index 1 to `i`) on a Fenwick Tree with `N` elements?", "A. O(1)", "B. O(log N)", "C. O(N)", "D. O(N log N)", "B"
"FenwickTree", "What is the time complexity of performing a point update (changing a single element's value) on a Fenwick Tree with `N` elements?", "A. O(1)", "B. O(log N)", "C. O(N)", "D. O(N log N)", "B"
"FenwickTree", "What is the space complexity of a Fenwick Tree built on an array of `N` elements?", "A. O(N)", "B. O(log N)", "C. O(N log N)", "D. O(N^2)", "A"
"FenwickTree", "How does a Fenwick Tree represent the array it operates on?", "A. As a complete binary tree where each node stores a range sum.", "B. As an array where each index stores the sum of a specific range, based on binary representation.", "C. As a linked list.", "D. As a hash table.", "B"
"FenwickTree", "Which binary operation is crucial to navigating a Fenwick Tree?", "A. Bitwise AND (&)", "B. Bitwise OR (|)", "C. Bitwise XOR (^)", "D. Bitwise NOT (~)", "A"
"FenwickTree", "To find the next parent node for an update operation in a Fenwick Tree, you add `val & (-val)` to the current index. What does `val & (-val)` compute?", "A. The next power of 2.", "B. The smallest set bit (LSB) of `val`.", "C. The largest set bit of `val`.", "D. The index of the parent.", "B"
"FenwickTree", "To find the parent for a prefix sum query in a Fenwick Tree, you subtract `val & (-val)` from the current index. What does this operation achieve?", "A. It moves to the next greater index.", "B. It effectively removes the LSB, moving to an ancestor node that covers a smaller range.", "C. It moves to a sibling node.", "D. It moves to a child node.", "B"
"FenwickTree", "Can a Fenwick Tree directly find the sum of an arbitrary range `[L, R]`?", "A. No, it only supports prefix sums.", "B. Yes, by computing `prefix_sum(R) - prefix_sum(L-1)`.", "C. Yes, but it requires O(N) time.", "D. Only if L is 1.", "B"
"FenwickTree", "When would you prefer a Fenwick Tree over a Segment Tree?", "A. When dealing with complex range updates and queries (e.g., range min/max).", "B. For simple point updates and prefix sum (or similar associative) queries, due to simpler implementation and smaller constant factors.", "C. When the array is dynamic.", "D. When memory is extremely limited (Fenwick Tree uses more).", "B"
"FenwickTree", "Can a Fenwick Tree be used for range updates and point queries?", "A. No, not directly.", "B. Yes, by using a difference array and performing two Fenwick Tree updates for a range update.", "C. Only if the array is sorted.", "D. Only for positive values.", "B"
