"Topic", "Question", "Option A", "Option B", "Option C", "Option D", "Correct Answer"
"ChineseRemainderTheorem", "What is the computational bottleneck in solving a CRT problem with very large moduli?", "A. Summing the terms.", "B. Calculating the modular inverses using Extended Euclidean Algorithm.", "C. Checking for primality of moduli.", "D. Finding the initial remainders.", "B"
"ChineseRemainderTheorem", "The Chinese Remainder Theorem can be generalized to rings other than integers. True or False?", "A. True", "B. False", "A"
"ChineseRemainderTheorem", "Consider x  5 (mod 6), x  1 (mod 4). Are the moduli coprime?", "A. Yes, 6 and 4 are coprime.", "B. No, GCD(6, 4) = 2  1.", "C. Only if x is even.", "D. It depends on the remainder.", "B"
"ChineseRemainderTheorem", "For x  5 (mod 6), x  1 (mod 4). If we try to find a solution, what does the first congruence give us?", "A. x = 6k + 5", "B. x = 4k + 1", "C. x = 5", "D. x = 1", "A"
"ChineseRemainderTheorem", "Substitute `x = 6k + 5` into `x  1 (mod 4)`: `6k + 5  1 (mod 4)`. What does this simplify to?", "A. 2k + 1  1 (mod 4)", "B. 2k + 5  1 (mod 4)", "C. 6k  -4 (mod 4)", "D. 6k  1 (mod 4)", "A"
"ChineseRemainderTheorem", "From `2k + 1  1 (mod 4)`, we get `2k  0 (mod 4)`. What is the general solution for `k`?", "A. k = 0", "B. k = 2j for any integer j (since 2k must be a multiple of 4).", "C. k = 4j", "D. k = 1", "B"
"ChineseRemainderTheorem", "If `k = 2j`, substitute back into `x = 6k + 5`. What is the general form of x?", "A. x = 6(2j) + 5 = 12j + 5", "B. x = 6j + 5", "C. x = 2j + 5", "D. x = 12j", "A"
"ChineseRemainderTheorem", "What is the smallest non-negative solution for x  5 (mod 6), x  1 (mod 4)?", "A. 1", "B. 5", "C. 12", "D. 17 (from 12j + 5, for j=1)", "B"
"ChineseRemainderTheorem", "What is the LCM of 6 and 4?", "A. 2", "B. 12", "C. 24", "D. 1", "B"
"ChineseRemainderTheorem", "The solution for x  5 (mod 6), x  1 (mod 4) is unique modulo what value?", "A. 24", "B. 12 (which is LCM(6,4))", "C. 6", "D. 4", "B"
"ChineseRemainderTheorem", "The existence of a solution for ax  b (mod m) depends on GCD(a, m) dividing b. This is distinct from the coprime moduli condition in standard CRT, but both relate to modular equations. True or False?", "A. True", "B. False", "A"
"ChineseRemainderTheorem", "If M is the product of pairwise coprime moduli m1, m2, ..., mk, then the integers modulo M form an isomorphic ring to the product of rings of integers modulo m_i. True or False?", "A. True (This is the essence of the CRT statement).", "B. False", "A"
"ChineseRemainderTheorem", "What is a 'system of congruences' in the context of CRT?", "A. A single equation involving modulo.", "B. A set of two or more linear congruences, each with the same variable 'x' but different moduli and remainders.", "C. A set of equations without moduli.", "D. A system of non-linear equations.", "B"
"ChineseRemainderTheorem", "The original purpose of CRT in ancient China was related to:", "A. Counting soldiers after a battle.", "B. Dividing land among farmers.", "C. Predicting celestial events.", "D. Building bridges.", "A"
"ChineseRemainderTheorem", "Can CRT be used if one of the moduli is 1?", "A. Yes, but a congruence modulo 1 (x  a (mod 1)) always holds for any integer x and remainder a, effectively providing no new constraint and can be ignored.", "B. No, it breaks the theorem.", "C. Only if 'a' is 0.", "D. Only if all other moduli are prime.", "A"
"ChineseRemainderTheorem", "When solving CRT, the property `(A * B) % M = ((A % M) * (B % M)) % M` is used to keep intermediate calculations manageable. True or False?", "A. True", "B. False", "A"
"ChineseRemainderTheorem", "If you have a very large number, and you want to calculate its value modulo several different small primes, can CRT help in reconstructing the original large number from these remainders?", "A. Yes, if the product of the small primes is greater than the large number.", "B. No, it only works for small numbers.", "C. Only if the large number is prime.", "D. Only if the large number is even.", "A"
"ChineseRemainderTheorem", "The method of 'successive substitution' is an alternative way to solve CRT problems. True or False?", "A. True", "B. False", "A"
"ChineseRemainderTheorem", "Consider the system: x  1 (mod 7), x  1 (mod 13). What is the smallest non-negative integer solution?", "A. 1", "B. 7", "C. 13", "D. 91", "A"
"ChineseRemainderTheorem", "If a CRT system has only one congruence, does it still have a solution?", "A. Yes, trivially, x  a1 (mod m1) is its own solution set.", "B. No, it requires at least two.", "C. Only if m1 is prime.", "D. Only if a1 is 0.", "A"
"ChineseRemainderTheorem", "What kind of numbers are the moduli `m_i` in the CRT typically assumed to be?", "A. Any integers.", "B. Positive integers.", "C. Prime numbers.", "D. Even numbers.", "B"
"ChineseRemainderTheorem", "The Chinese Remainder Theorem ensures that a unique solution exists under specific conditions. What happens if those conditions are not met, specifically that `GCD(m_i, m_j) != 1` for some pair `i, j`?", "A. The system always has no solution.", "B. The system always has multiple solutions.", "C. The system may have no solution, or it may have a unique solution modulo LCM(m1, m2, ..., mk).", "D. The system requires a different theorem entirely.", "C"
"EulerTotient", "What does Euler's Totient Function, (n), count?", "A. The number of prime numbers less than or equal to n.", "B. The number of divisors of n.", "C. The number of positive integers less than or equal to n that are relatively prime to n (coprime to n).", "D. The sum of the divisors of n.", "C"
"EulerTotient", "What is another name for Euler's Totient Function?", "A. Euler's Sigma function.", "B. Euler's Pi function.", "C. Euler's Phi function.", "D. Euler's Zeta function.", "C"
"EulerTotient", "What is (1)?", "A. 0", "B. 1", "C. Undefined", "D. 2", "B"
"EulerTotient", "If `p` is a prime number, what is (p)?", "A. p", "B. p - 1", "C. 1", "D. 0", "B"
"EulerTotient", "What is (7)?", "A. 6", "B. 7", "C. 1", "D. 0", "A"
"EulerTotient", "If `p` is a prime number and `k` is a positive integer, what is (p^k)?", "A. p^k - 1", "B. p^k", "C. p^k - p^(k-1)", "D. p^(k-1)", "C"
"EulerTotient", "What is (8)?", "A. 8 (Numbers: 1,2,3,4,5,6,7,8. Coprime: 1,3,5,7)", "B. 4", "C. 6", "D. 2", "B"
"EulerTotient", "What is (9)?", "A. 9 (Numbers: 1,2,3,4,5,6,7,8,9. Coprime: 1,2,4,5,7,8)", "B. 6", "C. 8", "D. 3", "B"
"EulerTotient", "Euler's Totient Function is a multiplicative function. What does this mean?", "A. (mn) = (m) * (n) always.", "B. (mn) = (m) + (n) always.", "C. If GCD(m, n) = 1, then (mn) = (m) * (n).", "D. If GCD(m, n) = 1, then (mn) = (m) + (n).", "C"
"EulerTotient", "What is the formula for (n) if `n` has prime factorization `p1^a1 * p2^a2 * ... * pk^ak`?", "A. `(n) = (p1-1) * (p2-1) * ... * (pk-1)`", "B. `(n) = n * (1 - 1/p1) * (1 - 1/p2) * ... * (1 - 1/pk)`", "C. `(n) = n / (p1 * p2 * ... * pk)`", "D. `(n) = p1^a1 * p2^a2 * ... * pk^ak`", "B"
"EulerTotient", "Calculate (10).", "A. 10 (Coprime: 1,3,7,9)", "B. 4", "C. 8", "D. 5", "B"
"EulerTotient", "Calculate (12).", "A. 12 (Coprime: 1,5,7,11)", "B. 6", "C. 4", "D. 8", "C"
"EulerTotient", "What is Euler's Totient Theorem?", "A. For any integers a and n, a^n  1 (mod n).", "B. If a and n are coprime positive integers, then a^(n)  1 (mod n).", "C. For any prime p, a^(p-1)  1 (mod p).", "D. The sum of all integers coprime to n is n * (n) / 2.", "B"
"EulerTotient", "Fermat's Little Theorem is a special case of Euler's Totient Theorem where:", "A. n is any composite number.", "B. n is a prime number.", "C. a is equal to n.", "D. (n) is 1.", "B"
"EulerTotient", "What is the purpose of Euler's Totient Theorem?", "A. To find the greatest common divisor.", "B. To simplify modular exponentiation with large exponents.", "C. To check if a number is prime.", "D. To factorize large numbers.", "B"
"EulerTotient", "If we want to calculate `a^b % n` where `GCD(a, n) = 1`, and `b` is very large, how can Euler's Totient Theorem help?", "A. Replace `b` with `b % n`.", "B. Replace `b` with `b % (n)`.", "C. Replace `a` with `a % n`.", "D. Replace `n` with `(n)`.", "B"
"EulerTotient", "What is `7^100 % 10` using Euler's Totient Theorem? ((10) = 4)", "A. `7^(100 % 10) % 10 = 7^0 % 10 = 1`", "B. `7^(100 % 4) % 10 = 7^0 % 10 = 1`", "C. `7^10 % 10 = 7`", "D. `7^4 % 10 = 1`", "B"
"EulerTotient", "For `a^b % n`, if `GCD(a, n)  1`, can Euler's Totient Theorem still be directly applied to reduce the exponent?", "A. Yes, always.", "B. No, the condition `GCD(a, n) = 1` is crucial.", "C. Only if `n` is prime.", "D. Only if `b` is small.", "B"
"EulerTotient", "What is the result of `2^10 % 5`? ((5) = 4)", "A. `2^(10 % 5) % 5 = 2^0 % 5 = 1`", "B. `2^(10 % 4) % 5 = 2^2 % 5 = 4`", "C. `2^1 % 5 = 2`", "D. `2^4 % 5 = 1`", "B"
"EulerTotient", "One significant application of Euler's Totient Function and Theorem is in which cryptographic algorithm?", "A. DES", "B. AES", "C. RSA", "D. SHA-256", "C"
"EulerTotient", "In RSA, if `n = p * q` (where p and q are large primes), what is `(n)` used to calculate?", "A. The public key `e`.", "B. The private key `d`.", "C. The message `m`.", "D. The ciphertext `c`.", "B"
"EulerTotient", "What does the sum `_{d|n} (d)` equal? (where the sum is over all positive divisors `d` of `n`)", "A. `(n)`", "B. `n`", "C. `2n`", "D. `n^2`", "B"
"EulerTotient", "Calculate (20).", "A. 20 (Prime factors: 2, 5. (20) = 20 * (1 - 1/2) * (1 - 1/5) = 20 * 1/2 * 4/5 = 8)", "B. 10", "C. 8", "D. 16", "C"
"EulerTotient", "For any `n > 2`, (n) is always an even number. True or False?", "A. True", "B. False (e.g., (1) = 1, (2) = 1)", "A"
"EulerTotient", "When is (n) equal to n - 1?", "A. When n is composite.", "B. When n is a prime number.", "C. When n is an even number.", "D. When n is 1.", "B"
"EulerTotient", "If `n` is a power of 2, say `n = 2^k` where `k  1`, what is (n)?", "A. `2^k`", "B. `2^(k-1)`", "C. `2^k - 1`", "D. `k`", "B"
"EulerTotient", "What is (16)?", "A. 16 (16 = 2^4, (16) = 2^4 - 2^3 = 16 - 8 = 8)", "B. 15", "C. 8", "D. 4", "C"
"EulerTotient", "The numbers `k` such that `1  k  n` and `GCD(k, n) = 1` are sometimes called:", "A. Divisors of n.", "B. Multiples of n.", "C. Totatives of n.", "D. Residues of n.", "C"
"EulerTotient", "If `p` is a prime, and `k >= 1`, then `(p^k) = p^k * (1 - 1/p)`. True or False?", "A. True", "B. False", "A"
"EulerTotient", "To compute (n) efficiently for a large `n`, what is the most common first step?", "A. Find all divisors of n.", "B. Find the prime factorization of n.", "C. Iterate from 1 to n and check GCD.", "D. Calculate n-1.", "B"
"EulerTotient", "What is the relationship between Euler's Totient Function and the order of the multiplicative group of integers modulo n, denoted (Z/nZ)*?", "A. (n) is the number of elements in (Z/nZ)*.", "B. (n) is the largest element in (Z/nZ)*.", "C. (n) is the sum of elements in (Z/nZ)*.", "D. There is no direct relationship.", "A"
"EulerTotient", "Consider the problem of finding the last digit of `3^2023`. Which aspect of Euler's Totient Theorem is relevant here?", "A. Finding `(10)`.", "B. Finding `(3)`.", "C. Finding `2023 % 3`.", "D. Factoring 2023.", "A"
"EulerTotient", "For `3^2023 % 10`, what is `(10)`?", "A. 10 (Prime factors: 2, 5. (10) = 10 * (1 - 1/2) * (1 - 1/5) = 10 * 1/2 * 4/5 = 4)", "B. 9", "C. 6", "D. 4", "D"
"EulerTotient", "Using Euler's Totient Theorem, `3^2023 % 10` can be simplified as `3^(2023 % (10)) % 10`. What is `2023 % 4`?", "A. 0", "B. 1", "C. 2", "D. 3", "D"
"EulerTotient", "What is the final result of `3^2023 % 10`?", "A. `3^0 % 10 = 1`", "B. `3^1 % 10 = 3`", "C. `3^2 % 10 = 9`", "D. `3^3 % 10 = 27 % 10 = 7`", "D"
"EulerTotient", "Is Euler's Totient Function always odd for `n > 2`?", "A. Yes", "B. No (e.g., (4) = 2, (6) = 2, (8) = 4)", "B"
"EulerTotient", "Can (n) be equal to 1 for `n > 2`?", "A. Yes, for some composite numbers.", "B. No, only for n = 1 and n = 2.", "C. Only if n is prime.", "D. Yes, if n is a power of a prime.", "B"
"EulerTotient", "What is the smallest number `n > 1` for which `(n) = 1`?", "A. 2", "B. 3", "C. 4", "D. No such number exists.", "A"
"EulerTotient", "If `n` is odd, then `(2n) = (n)`. True or False?", "A. True (Since GCD(2, n) = 1, (2n) = (2) * (n) = 1 * (n) = (n))", "B. False", "A"
"EulerTotient", "The sum `_{k=1 to n, GCD(k,n)=1} k` is equal to `n * (n) / 2` for `n > 1`. True or False?", "A. True", "B. False", "A"
"EulerTotient", "For `n=6`, what are the numbers coprime to `n` (totatives)?", "A. {1, 2, 3, 4, 5, 6}", "B. {1, 5}", "C. {1, 3, 5}", "D. {1, 2, 3}", "B"
"EulerTotient", "For `n=6`, what is `(6)`?", "A. 6", "B. 2", "C. 4", "D. 3", "B"
"EulerTotient", "What is the computational complexity of calculating `(n)` for a single large `n` if you first find its prime factorization?", "A. O(sqrt(n)) (dominated by factorization)", "B. O(log n)", "C. O(n)", "D. O(1)", "A"
"EulerTotient", "To calculate `(i)` for all `i` from 1 to `N` efficiently, which algorithm is typically used?", "A. Simple iteration.", "B. Sieve-like approach (e.g., modified Sieve of Eratosthenes).", "C. Recursive approach.", "D. Divide and conquer.", "B"
"EulerTotient", "Euler's Totient Theorem is a generalization of which other significant theorem in number theory?", "A. Chinese Remainder Theorem.", "B. Wilson's Theorem.", "C. Lagrange's Theorem.", "D. Fermat's Little Theorem.", "D"
"EulerTotient", "If `p` is a prime number, then the numbers `1, 2, ..., p-1` are all coprime to `p`. True or False?", "A. True", "B. False", "A"
"EulerTotient", "What is the maximum possible value for `(n)`?", "A. `n`", "B. `n - 1`", "C. `n / 2`", "D. It has no upper bound.", "B"
"EulerTotient", "The property `(n) < n` for `n > 1` is always true. True or False?", "A. True", "B. False", "A"
"EulerTotient", "If `n` is a prime power, say `n = p^k`, then the numbers not coprime to `n` are multiples of `p`. How many such multiples are there in the range `1` to `n`?", "A. `p`", "B. `p^k`", "C. `p^(k-1)`", "D. `k`", "C"
"EulerTotient", "What is `(100)`?", "A. 100 * (1 - 1/2) * (1 - 1/5) = 100 * 1/2 * 4/5 = 40", "B. 50", "C. 20", "D. 99", "A"
"InclusionExclusion", "What is the primary purpose of the Inclusion-Exclusion Principle?", "A. To calculate the Greatest Common Divisor (GCD) of numbers.", "B. To count the elements in the union of multiple finite sets.", "C. To find prime numbers up to a limit.", "D. To sort elements in an array.", "B"
"InclusionExclusion", "For two sets A and B, the principle states: |A  B| = ?", "A. |A| + |B|", "B. |A| + |B| - |A  B|", "C. |A| * |B|", "D. |A| - |B|", "B"
"InclusionExclusion", "For three sets A, B, and C, the principle states: |A  B  C| = ?", "A. |A| + |B| + |C|", "B. |A| + |B| + |C| - |A  B| - |A  C| - |B  C|", "C. |A| + |B| + |C| - |A  B| - |A  C| - |B  C| + |A  B  C|", "D. |A| * |B| * |C|", "C"
"InclusionExclusion", "What is the general pattern of signs in the Inclusion-Exclusion Principle for `n` sets?", "A. All terms are positive.", "B. All terms are negative.", "C. Alternating signs: positive for odd-sized intersections, negative for even-sized intersections.", "D. Alternating signs: positive for single sets, negative for pairs, positive for triplets, and so on.", "D"
"InclusionExclusion", "The Inclusion-Exclusion Principle is used to correct for what in simple summation?", "A. Errors in calculation.", "B. Elements that have been counted multiple times.", "C. Missing elements.", "D. Overlapping sets.", "B"
"InclusionExclusion", "If a problem asks to count items that satisfy 'at least one' of several properties, which principle is likely applicable?", "A. Pigeonhole Principle", "B. Inclusion-Exclusion Principle", "C. Multiplication Principle", "D. Sum Principle", "B"
"InclusionExclusion", "A survey found 50 people like apples, 60 like bananas, and 20 like both. How many people like apples OR bananas?", "A. 110", "B. 90", "C. 70", "D. 130", "B"
"InclusionExclusion", "In a group of 100 students, 30 take Math, 40 take Physics, and 10 take both. How many students take at least one of Math or Physics?", "A. 80", "B. 70", "C. 60", "D. 90", "C"
"InclusionExclusion", "What is the complexity of applying Inclusion-Exclusion for `N` properties?", "A. O(N)", "B. O(N^2)", "C. O(2^N) because it involves iterating through all subsets of properties.", "D. O(log N)", "C"
"InclusionExclusion", "Which of the following problems can be solved using Inclusion-Exclusion?", "A. Finding the shortest path in a graph.", "B. Counting permutations with specific restrictions (e.g., derangements).", "C. Calculating the sum of an arithmetic series.", "D. Sorting a list of numbers.", "B"
"InclusionExclusion", "What does a 'derangement' refer to?", "A. A permutation where no element appears in its original position.", "B. A permutation where all elements appear in their original position.", "C. A sorted permutation.", "D. A permutation with an even number of inversions.", "A"
"InclusionExclusion", "The number of derangements of `n` elements, denoted `!n` or `D_n`, can be calculated using Inclusion-Exclusion. True or False?", "A. True", "B. False", "A"
"InclusionExclusion", "What is the formula for Euler's Totient Function `(n)` using Inclusion-Exclusion (where `p_i` are distinct prime factors of `n`)?", "A. `n * (1 - 1/p1 - 1/p2 - ...)`", "B. `n - (n/p_i) + (n/(p_i*p_j)) - ...`", "C. `n + (n/p_i) - (n/(p_i*p_j)) + ...`", "D. `n / (p1 * p2 * ...)`", "B"
"InclusionExclusion", "When applying Inclusion-Exclusion to Euler's Totient Function, what do the 'properties' represent?", "A. Being prime.", "B. Being a multiple of a prime factor of n.", "C. Being relatively prime to n.", "D. Being less than n.", "B"
"InclusionExclusion", "How many integers from 1 to 100 are divisible by 2 or 3?", "A. 50 (divisible by 2) + 33 (divisible by 3) - 16 (divisible by 6) = 67", "B. 83", "C. 66", "D. 50", "A"
"InclusionExclusion", "What is the key idea when defining 'properties' for Inclusion-Exclusion?", "A. Each property should be mutually exclusive.", "B. Each property defines a set of elements to be counted.", "C. Properties must be ordered.", "D. Properties should be prime numbers.", "B"
"InclusionExclusion", "Consider a scenario where you want to count numbers that are NOT divisible by any of a set of primes. How would Inclusion-Exclusion be applied?", "A. Directly calculate using the principle for divisibility.", "B. Calculate the total numbers, then subtract the count of numbers divisible by at least one prime, which is found using Inclusion-Exclusion.", "C. It's not applicable for 'NOT' conditions.", "D. Use a sieve method instead.", "B"
"InclusionExclusion", "If we have a universe `U`, and sets `A_1, A_2, ..., A_n`, the number of elements in `U` that are in NONE of these sets is `|U| - |A_1  A_2  ...  A_n|`. True or False?", "A. True", "B. False", "A"
"InclusionExclusion", "In a scenario with 4 sets, `|A  B  C  D|` would involve how many terms with single intersections?", "A. 1", "B. 4", "C. 6", "D. 10", "B"
"InclusionExclusion", "In a scenario with 4 sets, `|A  B  C  D|` would involve how many terms with double intersections?", "A. 1", "B. 4", "C. 6", "D. 10", "C"
"InclusionExclusion", "In a scenario with 4 sets, `|A  B  C  D|` would involve how many terms with triple intersections?", "A. 1", "B. 4", "C. 6", "D. 10", "B"
"InclusionExclusion", "In a scenario with 4 sets, `|A  B  C  D|` would involve how many terms with quadruple intersections?", "A. 1", "B. 4", "C. 6", "D. 10", "A"
"InclusionExclusion", "The number of terms in the Inclusion-Exclusion Principle for `n` sets is `2^n - 1`. True or False?", "A. True", "B. False", "A"
"InclusionExclusion", "Which sign corresponds to terms representing intersections of an odd number of sets?", "A. Positive (+)", "B. Negative (-)", "C. Alternating based on value.", "D. Always zero.", "A"
"InclusionExclusion", "Which sign corresponds to terms representing intersections of an even number of sets?", "A. Positive (+)", "B. Negative (-)", "C. Alternating based on value.", "D. Always zero.", "B"
"InclusionExclusion", "In combinatorial problems, Inclusion-Exclusion is useful when direct counting leads to what issue?", "A. Too few items being counted.", "B. Overcounting certain elements.", "C. Incorrect ordering of elements.", "D. Prime numbers appearing.", "B"
"InclusionExclusion", "The problem of counting permutations where certain elements are fixed in their positions can be simplified by considering properties of fixed positions and applying Inclusion-Exclusion. True or False?", "A. True", "B. False", "A"
"InclusionExclusion", "If a problem asks for elements that satisfy `exactly k` properties, can Inclusion-Exclusion be used?", "A. No, only 'at least one'.", "B. Yes, by using a more advanced form or combining with binomial coefficients.", "C. Only if k = 1.", "D. Only if k = N.", "B"
"InclusionExclusion", "Consider counting integers up to N that are not divisible by any of `p1, p2, p3`. The solution starts with `N - (count of multiples of p1 + count of multiples of p2 + ...)` and then adjusts for overcounting. True or False?", "A. True", "B. False", "A"
"InclusionExclusion", "The Inclusion-Exclusion Principle is derived from the principle of mathematical induction. True or False?", "A. True", "B. False", "A"
"InclusionExclusion", "What is the common term for applying Inclusion-Exclusion to count derangements?", "A. Euler's Derangement Formula.", "B. De Montmort's Formula (or just Derangement Formula).", "C. Principle of Permutations.", "D. Fibonacci Sequence.", "B"
"InclusionExclusion", "If you want to count elements that have property P1 and P2, but NOT P3. Can Inclusion-Exclusion be used?", "A. Yes, but it's more complex, often by defining new sets for the intersection of P1 and P2, and then applying IE for P3 on that set.", "B. No, it only works for unions.", "C. Only if P1, P2, P3 are primes.", "D. Only for small sets.", "A"
"InclusionExclusion", "The Inclusion-Exclusion Principle is a fundamental concept in:", "A. Calculus.", "B. Linear Algebra.", "C. Combinatorics and Probability.", "D. Geometry.", "C"
"InclusionExclusion", "A variant of Inclusion-Exclusion for probability states: P(A  B) = P(A) + P(B) - P(A  B). True or False?", "A. True", "B. False", "A"
"InclusionExclusion", "What is the primary challenge in applying Inclusion-Exclusion for many sets?", "A. Defining the sets correctly.", "B. Calculating the sizes of all possible intersections, which can be numerous.", "C. Remembering the signs.", "D. Finding the union.", "B"
"InclusionExclusion", "Counting surjective functions from a set of size `m` to a set of size `n` often involves Inclusion-Exclusion. True or False?", "A. True", "B. False", "A"
"InclusionExclusion", "If `n` is a square-free integer, what is `(n)` using Inclusion-Exclusion directly?", "A. `n * (1 -  1/p_i +  1/(p_i p_j) - ...)`", "B. `n -  (n/p_i) +  (n/(p_i p_j)) - ...` (This is the formula where p_i are distinct prime factors)", "C. `n - 1`", "D. `n`", "B"
"InclusionExclusion", "Which of the following is a common mistake when using Inclusion-Exclusion?", "A. Forgetting to alternate signs.", "B. Incorrectly calculating the size of intersections.", "C. Not considering all possible subsets of properties.", "D. All of the above.", "D"
"InclusionExclusion", "For `N` sets, how many terms are there in the first level of inclusion (single sets)?", "A. `N`", "B. `N choose 2`", "C. `N choose 3`", "D. `2^N`", "A"
"InclusionExclusion", "For `N` sets, how many terms are there in the first level of exclusion (pairwise intersections)?", "A. `N`", "B. `N choose 2`", "C. `N choose 3`", "D. `2^N`", "B"
"InclusionExclusion", "What is the maximum number of people in a group of 30 that can speak at least one of English, French, or German, if 15 speak English, 10 speak French, 5 speak German, and no one speaks more than one language?", "A. 30", "B. 20", "C. 15", "D. 0", "B"
"InclusionExclusion", "If a problem mentions 'none of the properties' or 'exactly none', how does Inclusion-Exclusion apply?", "A. Directly, as the final term in the formula.", "B. By calculating the total universe size minus the result of the standard Inclusion-Exclusion for 'at least one'.", "C. It's irrelevant.", "D. Only by brute force.", "B"
"InclusionExclusion", "Can Inclusion-Exclusion be used to count numbers divisible by `A` OR `B` OR `C` if `A`, `B`, `C` are not necessarily prime?", "A. No, only primes.", "B. Yes, the principle applies to any sets, not just those defined by prime divisibility.", "C. Only if `A`, `B`, `C` are coprime.", "D. Only if `A`, `B`, `C` are even.", "B"
"InclusionExclusion", "What does the symbol `|S|` represent in set theory?", "A. The sum of elements in set S.", "B. The number of elements in set S (cardinality).", "C. The absolute value of elements in set S.", "D. The product of elements in set S.", "B"
"InclusionExclusion", "The Inclusion-Exclusion Principle can be visualized using what?", "A. A number line.", "B. Venn diagrams.", "C. A Cartesian coordinate system.", "D. A truth table.", "B"
"InclusionExclusion", "When dealing with a universe of elements `U`, the number of elements with *none* of the properties `P_1, ..., P_n` is `N(P_1' P_2' ... P_n')`, where `P_i'` denotes not having property `P_i`. This equals `|U| - N(P_1 or P_2 or ... or P_n)`. True or False?", "A. True", "B. False", "A"
"InclusionExclusion", "Which famous combinatorial problem involves counting the number of ways to seat `n` couples at a round table so that no couple sits next to each other, often solved with Inclusion-Exclusion?", "A. The Handshaking Lemma.", "B. The Problme des Mnages.", "C. The Traveling Salesman Problem.", "D. The Bridge Problem.", "B"
"InclusionExclusion", "If a problem requires counting arrangements with 'at least one' restriction, the Inclusion-Exclusion Principle is a direct method. True or False?", "A. True", "B. False", "A"
